{
  "activation_delay_s": 0.032,
  "activation_time_constant_s": 0.07699999999999999,
  "bar_attachment_offset_m": [
    0.0,
    0.0
  ],
  "bar_rack_damping_N_s_m": 780.0,
  "bar_rack_stiffness_N_m": 25200.0,
  "body_mass_kg": 79.78,
  "braking_gain": 1.407,
  "contact_damping_N_s_m": 5600.0,
  "contact_stiffness_N_m": 142800.0,
  "encoder_delay_steps": 2,
  "encoder_filter_tau_s": 0.016,
  "encoder_offset_m": 0.0,
  "encoder_scale": 1.0,
  "force_plate_bias_N": 0.0,
  "force_plate_scale": 1.0,
  "hand_grip_damping_N_s_m": 510.0,
  "hand_grip_stiffness_N_m": 15800.0,
  "joint_damping_Nm_s_rad": [
    152.5,
    182.5,
    125.0
  ],
  "joint_stiffness_Nm_rad": [
    6100.0,
    10130.0,
    4550.0
  ],
  "lpt_tether_damping_N_s_m": 0.0,
  "lpt_tether_stiffness_N_m": 0.0,
  "propulsive_gain": 2.028
}
